{
  "schema_version": "1.0",
  "id": "roguelite-v1",
  "version": 1,
  "title": "Complete Roguelite Quality Profile",
  "description": "Thirty-nine classified qualities for coherent roguelite design; each may be required, optional, or not applicable with rationale.",
  "items": [
    {"id": "ROG-001", "category": "core_experience", "title": "Great story", "guidance": "Define compelling themes, memorable characters, and meaningful discoveries when narrative applies.", "evidence": ["blueprint", "playtest"]},
    {"id": "ROG-002", "category": "core_experience", "title": "Infinite replayability", "guidance": "Runs remain fresh through encounters, choices, builds, and challenges.", "evidence": ["content_catalog", "playtest"]},
    {"id": "ROG-003", "category": "core_experience", "title": "Strong roguelite structure", "guidance": "Each run includes controlled randomness, risk, failure, and a reason to retry.", "evidence": ["blueprint", "mechanic_spec"]},
    {"id": "ROG-004", "category": "core_experience", "title": "Permanent upgrades", "guidance": "Lasting unlocks or options between runs are useful and bounded.", "evidence": ["mechanic_spec", "runtime"]},
    {"id": "ROG-005", "category": "core_experience", "title": "Base building", "guidance": "If selected, the hub grows through useful services, characters, upgrades, and story.", "evidence": ["content_catalog", "runtime"]},
    {"id": "ROG-006", "category": "core_experience", "title": "Multiple playable characters", "guidance": "If selected, characters have distinct mechanics, strengths, weaknesses, and progression.", "evidence": ["content_catalog", "playtest"]},
    {"id": "ROG-007", "category": "core_experience", "title": "Great boss fights", "guidance": "Bosses are memorable, mechanically distinct, readable, and fair.", "evidence": ["content_catalog", "runtime", "playtest"]},
    {"id": "ROG-008", "category": "core_experience", "title": "Huge enemy variety", "guidance": "Enemy roles and behaviors create useful variety within the release budget.", "evidence": ["content_catalog", "playtest"]},
    {"id": "ROG-009", "category": "core_experience", "title": "Well-designed stages", "guidance": "Stages are readable, varied, strategic, and rewarding to explore.", "evidence": ["content_catalog", "runtime", "playtest"]},
    {"id": "ROG-010", "category": "core_experience", "title": "Great effects and animations", "guidance": "Movement, attacks, abilities, impacts, and events have expressive feedback.", "evidence": ["asset_manifest", "runtime", "playtest"]},
    {"id": "ROG-011", "category": "core_experience", "title": "Great visuals", "guidance": "The release has a clear, attractive, and recognizable visual identity.", "evidence": ["creative_bible", "human_approval"]},
    {"id": "ROG-012", "category": "core_experience", "title": "Smooth controls", "guidance": "Movement, aim, dodge, attack, and interaction are responsive and precise.", "evidence": ["mechanic_spec", "runtime", "playtest"]},
    {"id": "ROG-013", "category": "core_experience", "title": "Well-balanced gameplay", "guidance": "Characters, enemies, weapons, upgrades, and difficulty have explicit targets and tuning ranges.", "evidence": ["mechanic_spec", "playtest"]},
    {"id": "ROG-014", "category": "core_experience", "title": "Great level and build progression", "guidance": "Runs regularly unlock meaningful power and new strategies.", "evidence": ["mechanic_spec", "playtest"]},
    {"id": "ROG-015", "category": "core_experience", "title": "Engaging in-game sound", "guidance": "Music, combat, environment, voice, and UI sound support action and atmosphere.", "evidence": ["asset_manifest", "runtime", "accessibility"]},
    {"id": "ROG-016", "category": "gameplay_depth", "title": "Strong core gameplay loop", "guidance": "Fighting, exploring, rewards, upgrades, and new runs are satisfying as a connected loop.", "evidence": ["blueprint", "runtime", "playtest"]},
    {"id": "ROG-017", "category": "gameplay_depth", "title": "Meaningful player choices", "guidance": "Weapons, routes, characters, upgrades, and rewards present real trade-offs.", "evidence": ["mechanic_spec", "playtest"]},
    {"id": "ROG-018", "category": "gameplay_depth", "title": "Build variety and synergy", "guidance": "Abilities, equipment, items, and effects combine through explicit interaction rules.", "evidence": ["mechanic_spec", "content_catalog", "playtest"]},
    {"id": "ROG-019", "category": "gameplay_depth", "title": "Fair but challenging difficulty", "guidance": "Challenge avoids unavoidable damage, unfair surprises, and empty health inflation.", "evidence": ["mechanic_spec", "playtest"]},
    {"id": "ROG-020", "category": "gameplay_depth", "title": "Clear enemy and boss telegraphs", "guidance": "Dangerous attacks are recognizable, learnable, and reactable.", "evidence": ["mechanic_spec", "runtime", "playtest"]},
    {"id": "ROG-021", "category": "gameplay_depth", "title": "Strong combat feedback", "guidance": "Hits, criticals, blocks, dodges, parries, and abilities communicate impact accessibly.", "evidence": ["mechanic_spec", "runtime", "playtest"]},
    {"id": "ROG-022", "category": "gameplay_depth", "title": "Good pacing", "guidance": "Combat, exploration, story, upgrades, and downtime sustain attention without exhaustion.", "evidence": ["blueprint", "playtest"]},
    {"id": "ROG-023", "category": "gameplay_depth", "title": "Rewarding risk versus reward", "guidance": "Optional danger offers proportionate and understandable rewards.", "evidence": ["mechanic_spec", "playtest"]},
    {"id": "ROG-024", "category": "gameplay_depth", "title": "Distinct character design", "guidance": "Characters change play patterns rather than only statistics.", "evidence": ["content_catalog", "playtest"]},
    {"id": "ROG-025", "category": "gameplay_depth", "title": "Interesting weapons and abilities", "guidance": "Equipment differs in range, rhythm, mechanics, strengths, weaknesses, and tactics.", "evidence": ["content_catalog", "mechanic_spec", "playtest"]},
    {"id": "ROG-026", "category": "gameplay_depth", "title": "Smart enemy combinations", "guidance": "Enemy groups create tactical situations through complementary roles.", "evidence": ["content_catalog", "runtime", "playtest"]},
    {"id": "ROG-027", "category": "gameplay_depth", "title": "Procedural generation with structure", "guidance": "Generators, pools, weights, constraints, and seeds produce intentional readable stages.", "evidence": ["mechanic_spec", "test", "runtime"]},
    {"id": "ROG-028", "category": "gameplay_depth", "title": "Secrets and discovery", "guidance": "Selected secrets, routes, events, lore, bosses, and rewards encourage exploration.", "evidence": ["content_catalog", "playtest"]},
    {"id": "ROG-029", "category": "progression_motivation", "title": "Satisfying economy", "guidance": "Currencies stay useful, understandable, rewarding, and do not require excessive grinding.", "evidence": ["mechanic_spec", "playtest"]},
    {"id": "ROG-030", "category": "progression_motivation", "title": "Good onboarding", "guidance": "New rules arrive naturally without excessive tutorial load.", "evidence": ["blueprint", "playtest"]},
    {"id": "ROG-031", "category": "progression_motivation", "title": "Clear user interface and information", "guidance": "Health, damage, effects, objectives, choices, currencies, and resources are understandable.", "evidence": ["mechanic_spec", "runtime", "accessibility"]},
    {"id": "ROG-032", "category": "progression_motivation", "title": "Accessibility options", "guidance": "Remapping, subtitles, text size, color, aim, effects, and difficulty support are classified.", "evidence": ["blueprint", "manual_qa"]},
    {"id": "ROG-033", "category": "progression_motivation", "title": "Reliable saving and run recovery", "guidance": "Crashes or interruptions do not erase accepted permanent or recoverable progress.", "evidence": ["mechanic_spec", "test", "manual_qa"]},
    {"id": "ROG-034", "category": "progression_motivation", "title": "Strong technical performance", "guidance": "Frame rate, input latency, loading time, stability, and bug budgets are enforced.", "evidence": ["test", "runtime", "build"]},
    {"id": "ROG-035", "category": "progression_motivation", "title": "Worthwhile endgame", "guidance": "Selected difficulty modifiers, routes, bosses, achievements, or builds extend mastery.", "evidence": ["blueprint", "content_catalog", "playtest"]},
    {"id": "ROG-036", "category": "progression_motivation", "title": "Respect for player time", "guidance": "Run length, grind, repetition, collection, and unskippable sequences stay within budgets.", "evidence": ["blueprint", "playtest"]},
    {"id": "ROG-037", "category": "progression_motivation", "title": "Unique identity", "guidance": "Theme, mechanics, atmosphere, art, or structure clearly distinguish the game.", "evidence": ["blueprint", "human_approval"]},
    {"id": "ROG-038", "category": "progression_motivation", "title": "Emotional payoff", "guidance": "Progression, relationships, discoveries, victories, defeats, and endings create intended emotional beats.", "evidence": ["blueprint", "playtest"]},
    {"id": "ROG-039", "category": "progression_motivation", "title": "Consistency between systems", "guidance": "Story, combat, progression, hub, visuals, and sound support one coherent experience.", "evidence": ["quality_assessment", "human_approval"]}
  ]
}
